{
  "_synthetic": true,
  "id": "90391",
  "url": "https://o.bttn.io/19BIp9F5cLj?tag=marketplace-usw-20",
  "title": "5QT Enameled Cast Iron Dutch Oven with Lid",
  "strikePrice": 70,
  "price": 38,
  "photos": [
    {
      "url": "https://www.bargainhunter.com/wp-content/uploads/sites/5/2025/01/dutch-oven.jpg"
    }
  ]
}
